职位名称,职位地址,薪资,学历经验要求,公司名称,公司信息,公司福利,详情页链接
Python开发工程师,上海·浦东新区·三林,25-35K·14薪,经验不限本科,联洋国融,互联网不需要融资100-499人,交通补助，股票期权，节日福利，五险一金，带薪年假，零食下午茶，年终奖，通讯补贴，加班补助，定期体检，餐补,https://www.zhipin.com/job_detail/dee78b2cde8c730c1XR-3t-5E1NZ.html
Python量化开发工程师,上海·浦东新区·张江,10-15K·13薪,在校/应届硕士,量投科技,计算机软件未融资100-499人,员工旅游，补充医疗保险，定期体检，五险一金，股票期权，带薪年假，交通补助，节日福利，年终奖,https://www.zhipin.com/job_detail/29f850f1ab13f6b21n1z2tq_EFNU.html
python开发工程师,上海·普陀区·长风,15-18K·13薪,3-5年大专,伦伟实业,信息安全不需要融资100-499人,交通补助，带薪年假，五险一金，加班补助，年终奖，员工旅游，全勤奖，节日福利,https://www.zhipin.com/job_detail/c0d27c0768f026861nF_0ti4FVBX.html
Python后端研发工程师,上海,18-30K·15薪,3-5年本科,斗象科技,信息安全D轮及以上500-999人,年终奖，员工旅游，零食下午茶，股票期权，定期体检，五险一金，节日福利，带薪年假，餐补，加班补助，交通补助,https://www.zhipin.com/job_detail/c113c121345c4e711nZz2du5GFRQ.html
python开发工程师,上海·闵行区·吴泾,12-24K,经验不限本科,图灵量子,电子/半导体/集成电路天使轮20-99人,五险一金,https://www.zhipin.com/job_detail/53cc950ffbafbf711nx73dW6FFNQ.html
中级Python开发工程师,上海·浦东新区·世纪公园,13-15K,3-5年本科,博彦科技,计算机软件已上市10000人以上,五险一金，定期体检，年终奖，免费班车，节日福利，带薪年假,https://www.zhipin.com/job_detail/b0440970439d2e6e1XZz2du4GFVT.html
python开发工程师,上海·徐汇区·徐家汇,8-12K·13薪,1-3年大专,百脑汇,其他行业不需要融资100-499人,员工旅游，带薪年假，节日福利，年终奖，五险一金,https://www.zhipin.com/job_detail/5fa63a6ca34dc2a81nN-3Nu5EVVX.html
Python开发工程师,上海·黄浦区·新天地,15-30K,1-3年本科,谷露软件,计算机软件A轮20-99人,五险一金，年终奖，带薪年假，股票期权，节日福利,https://www.zhipin.com/job_detail/13848fb58ebffce21XVz09y5GFZX.html
python开发工程师,上海,15-20K,3-5年本科,月新生科,数据服务未融资0-20人,补充医疗保险，餐补，带薪年假，定期体检，五险一金，节日福利，交通补助，员工旅游，年终奖，通讯补贴,https://www.zhipin.com/job_detail/7af68cf7859eaf501nJy3t6-EFBS.html
Python高级开发工程师,上海·杨浦区·东外滩,15-25K·13薪,3-5年本科,Finture科技,移动互联网A轮100-499人,定期体检，年终奖，员工旅游，五险一金，带薪年假，股票期权，加班补助，零食下午茶，补充医疗保险,https://www.zhipin.com/job_detail/e4bb659e6dd512c11XVz39m9E1VR.html
高级python开发,上海·长宁区·北新泾,15-30K·15薪,3-5年本科,长城汽车数字化中心,汽车生产已上市10000人以上,年终奖，节日福利，股票期权，五险一金，带薪年假，加班补助，全勤奖，包吃，定期体检,https://www.zhipin.com/job_detail/f80c24566a4e0f191nx73N-6GFNT.html
Python高级开发工程师,上海,15-25K·14薪,3-5年本科,纳纳科技,数据服务不需要融资100-499人,节日福利，五险一金，零食下午茶，交通补助，员工旅游，住房补贴，带薪年假，年终奖，餐补，加班补助,https://www.zhipin.com/job_detail/05c98499ab2d5e6a1XV-09S0FFpU.html
Python后端开发工程师,上海·浦东新区·张江,12-22K·14薪,在校/应届本科,光之树科技,互联网A轮20-99人,年终奖，零食下午茶，节日福利，带薪年假，定期体检，五险一金,https://www.zhipin.com/job_detail/085dac8af85381c51nJ83d6_E1JX.html
Python开发工程师（上海）,上海·浦东新区·塘桥,12-20K·14薪,经验不限本科,华讯网络,计算机软件未融资1000-9999人,培养体系，员工旅游，交通补助，通讯补贴，带薪年假，定期体检，节日福利，加班补助，补充医疗保险，五险一金，年终奖，股票期权,https://www.zhipin.com/job_detail/fb6348dd79c0b5f91nN73t24FlRU.html
高级Python交付工程师,上海·浦东新区·张江,12-24K·13薪,3-5年本科,自然而然,互联网天使轮20-99人,节日福利，五险一金，零食下午茶，年终奖，带薪年假,https://www.zhipin.com/job_detail/ac7d4d826e9a74a31nJz0ty1FFFY.html
Python软件开发工程师,上海·浦东新区·张江,15-20K,1-3年本科,Medtrum,医疗设备/器械C轮100-499人,,https://www.zhipin.com/job_detail/599052e68288a4e21nJ60t-8FFFQ.html
Python后端开发工程师,上海·浦东新区·金桥,15-17K,3-5年本科,Prime IFM,物业服务未融资100-499人,定期体检，五险一金，员工旅游，零食下午茶，年终奖,https://www.zhipin.com/job_detail/e3994c08fa8f76061n170tm8GVVY.html
高级/资深后端工程师（python）,上海·静安区·大宁,20-40K·16薪,5-10年本科,品览数据,数据服务A轮100-499人,节日福利，员工旅游，零食下午茶，带薪年假，交通补助，股票期权，年终奖，定期体检，五险一金,https://www.zhipin.com/job_detail/074064b519ab69a71nN_2961FVdQ.html
python研发工程师,上海·浦东新区·陆家嘴,15-30K,经验不限本科,招鲤,互联网A轮0-20人,年终奖，员工旅游，带薪年假，零食下午茶，五险一金，餐补，定期体检，节日福利，股票期权,https://www.zhipin.com/job_detail/8cc56d49d86608351nZ90t21E1RT.html
Python后端工程师,上海·闵行区·老闵行,20-40K·15薪,5-10年大专,宾通智能,计算机软件A轮100-499人,交通补助，餐补，通讯补贴，五险一金，加班补助，股票期权，带薪年假，年终奖，零食下午茶，员工旅游，节日福利,https://www.zhipin.com/job_detail/373c81147239f8f21nd429y4GFBZ.html
python实施工程师/RPA实施工程师,上海·静安区·大宁,13-21K·16薪,经验不限大专,壹沓科技,企业服务A轮100-499人,定期体检，员工旅游，带薪年假，交通补助，节日福利，餐补，五险一金，年终奖，股票期权，零食下午茶,https://www.zhipin.com/job_detail/96f047fc67ee86a81XR_29m-EFFZ.html
Python少儿编程讲师（地点就近）,上海·黄浦区·西藏南路,12-18K·13薪,经验不限本科,小码教育,在线教育C轮1000-9999人,股票期权，年终奖，节日福利，零食下午茶，餐补，带薪年假，员工旅游，五险一金,https://www.zhipin.com/job_detail/d4734d6710dae5751n1-09i5GFBT.html
Python后端开发工程师（电商）,上海·长宁区·新华路,15-25K,3-5年大专,点正互联网科技,电子商务未融资100-499人,年终奖，五险一金，零食下午茶，员工旅游，加班补助，带薪年假,https://www.zhipin.com/job_detail/071f84ec6439079b1XZ73ty5GFVS.html
Python高级软件开发工程师,上海·徐汇区·漕河泾,15-30K·13薪,1-3年本科,杰恩,建筑设计已上市500-999人,节日福利，五险一金，零食下午茶，带薪年假，定期体检，员工旅游,https://www.zhipin.com/job_detail/0b5ca38f96d04a391nd42tS7FFJV.html
Python中级工程师,上海·浦东新区·张江,18-25K,经验不限本科,数行科技,数据服务A轮20-99人,带薪年假，补充医疗保险，年终奖，五险一金，零食下午茶，通讯补贴，股票期权，员工旅游,https://www.zhipin.com/job_detail/5bc59214aeb329eb1HV93du5FFM~.html
高级python后端工程师,上海·闵行区·浦江,20-35K·13薪,5-10年本科,之江生物,医疗健康已上市500-999人,宿舍，加班补助，员工旅游，节日福利，年终奖，定期体检，五险一金，带薪年假，零食下午茶，餐补,https://www.zhipin.com/job_detail/d48c7b44c5f98c271n1z29y8E1NS.html
python开发工程师（智能客服）,上海,25-35K·15薪,5-10年大专,乐言科技,互联网D轮及以上1000-9999人,节日福利，带薪年假，五险一金，补充医疗保险，定期体检，零食下午茶，年终奖,https://www.zhipin.com/job_detail/6cff60456c5d49ad1XR60tm_FFtZ.html
中高级Python后端开发工程师,上海,15-30K·14薪,3-5年本科,旭荣科技,互联网未融资20-99人,1年2次调薪，年终奖，零食下午茶，带薪病假，餐补，五险一金，健身俱乐部，节日福利，定期海外旅游，国家法定假期，补充医疗保险，定期户外拓展，慰问礼金，定期团建，生育礼金，带薪年假，结婚礼金,https://www.zhipin.com/job_detail/aa98229ce10dd6121nZ409S4EFBQ.html
python开发（浦发银行）,上海·浦东新区·陆家嘴,12-20K,3-5年大专,汉克时代,互联网不需要融资1000-9999人,通讯补贴，住房补贴，年终奖，交通补助，五险一金，节日福利，带薪年假，定期体检，员工旅游,https://www.zhipin.com/job_detail/aec1a34b66b6ce481n1_3dm9EFBU.html
python后端开发工程师,上海·黄浦区·老西门,15-20K·13薪,1-3年本科,零点有数,数据服务已上市500-999人,五险一金，节日福利，年终奖，周末双休，餐补，员工旅游，带薪年假,https://www.zhipin.com/job_detail/b03ef5450c5200711nxy3d64E1RZ.html
Python开发工程师（广告技术）,上海·徐汇区·漕河泾,25-35K·14薪,3-5年本科,莉莉丝游戏,游戏未融资1000-9999人,五险一金，节日福利，零食下午茶，带薪年假，定期体检，年终奖，员工旅游，加班补助,https://www.zhipin.com/job_detail/061b9f9f01453f7a1n1629y_EltX.html
高级量化交易系统开发工程师（Python）,上海·浦东新区·南码头,15-26K,3-5年硕士,盾枫,基金不需要融资0-20人,股票期权，定期体检，五险一金，节日福利，零食下午茶，年终奖，补充医疗保险，带薪年假，员工旅游,https://www.zhipin.com/job_detail/c1744f8843121c7b1nx80tW8ElpT.html
Python研发工程师/后端开发工程师,上海·杨浦区·东外滩,23-35K·13薪,5-10年本科,上海展湾信息科技,计算机软件A轮100-499人,员工旅游，零食下午茶，带薪年假，年终奖，定期体检，五险一金，股票期权，节日福利,https://www.zhipin.com/job_detail/ccc40f2fceea1de01nJ409u-FVdV.html
中级Python开发工程师,上海·徐汇区·漕河泾,15-20K,1-3年本科,牙木科技,计算机软件不需要融资100-499人,定期体检，年终奖，五险一金，零食下午茶，节日福利，带薪年假，补充医疗保险，通讯补贴,https://www.zhipin.com/job_detail/fdd6996791a414da1XR-29u6EVBR.html
Python开发工程师,上海,25-35K,3-5年本科,淘利资产,基金未融资20-99人,交通补助，员工旅游，定期体检，五险一金，餐补，带薪年假，全勤奖,https://www.zhipin.com/job_detail/c3d2dcdad2a09a391nF53t-0EFJR.html
Python,上海,8-9K·14薪,在校/应届学历不限,中集飞瞳,智能硬件已上市100-499人,补充医疗保险，年终奖，股票期权，五险一金，包吃，通讯补贴，节日福利，交通补助，餐补,https://www.zhipin.com/job_detail/fe705fdd5ca3ef6b1nVy3d-_FVNV.html
业务平台优化-量化开发工程师（python）,上海·虹口区·四川北路,35-65K,经验不限本科,启林投资,基金未融资100-499人,扁平管理，五险一金，零食下午茶，定期体检，团建旅游，年终奖，带薪年假，节日福利,https://www.zhipin.com/job_detail/0dda7d1502a428c31nJ72di9ElVT.html
Python开发工程师(英语口语流利沟通）,上海·浦东新区·三林,23-35K·13薪,3-5年本科,Cognizant,计算机软件已上市1000-9999人,年终奖，餐补，定期体检，交通补助，节日福利，五险一金，免费班车，带薪年假，补充医疗保险,https://www.zhipin.com/job_detail/b7dec47ac6dc2f0a1XVz3t-8FVFV.html
Python开发工程师-上海数据存储与机器视觉,上海·浦东新区·金桥,20-35K·15薪,经验不限本科,华为,计算机软件不需要融资10000人以上,员工旅游，节日福利，年终奖，股票期权，零食下午茶，餐补，加班补助，五险一金，补充医疗保险，定期体检,https://www.zhipin.com/job_detail/f6afd35f9c5591031n173dm8FVVT.html
少儿编程老师（web/python/Java）,上海·松江区·松江大学城,10-15K,1-3年本科,童程童美,在线教育已上市1000-9999人,零食下午茶，加班补助，五险一金，乐居计划，股票期权，定期体检，带薪年假，年终奖，员工旅游，餐补，补充医疗保险，节日福利,https://www.zhipin.com/job_detail/15190c7fcfcca7a11XR42Nm_GFJW.html
python开发,上海·浦东新区·世纪公园,20-40K·16薪,1-3年本科,Soul App,社交网络D轮及以上1000-9999人,零食下午茶，节日福利，年终奖，股票期权，带薪年假,https://www.zhipin.com/job_detail/0985b97a671752901n163dy6ElpW.html
python工程师,上海·普陀区·长风,20-25K,1-3年本科,众标科技,数据服务不需要融资20-99人,餐补，零食下午茶，股票期权，五险一金，年终奖，员工旅游，带薪年假,https://www.zhipin.com/job_detail/d77727d68b7dbf751nFy3di9EVBT.html
Python开发工程师,上海·青浦区·赵巷,15-27K,经验不限本科,东普科技,物流/仓储不需要融资1000-9999人,加班补助，包吃，节日福利，五险一金，带薪年假，餐补，交通补助，零食下午茶，年终奖，全勤奖，定期体检，免费班车,https://www.zhipin.com/job_detail/da3796c491297ce11XV50927F1ZU.html
Python开发,上海·浦东新区·金桥,11-22K,1-3年本科,软通动力信息技术集团,计算机软件已上市10000人以上,餐补，补充医疗保险，五险一金，员工旅游，零食下午茶，交通补助，全勤奖，包吃，通讯补贴，节日福利，年终奖，免费班车，加班补助，带薪年假，定期体检,https://www.zhipin.com/job_detail/def3782e9e3cb41f1nd70927GVtW.html
python开发,上海,12-22K·13薪,经验不限本科,瞬联科技,计算机软件不需要融资1000-9999人,补充医疗保险，加班补助，五险一金，带薪年假，节日福利，定期体检，零食下午茶,https://www.zhipin.com/job_detail/c8ecddfa9206057a1nN-3N-7FFdT.html
Python开发工程师,上海·静安区·汶水路,20-40K,3-5年本科,有个机器人,其他行业C轮100-499人,五险一金，节日福利，带薪年假，年终奖，股票期权，补充医疗保险，员工旅游,https://www.zhipin.com/job_detail/6f7254dc10e0e7161n1_2Ni9GVJW.html
Python（应届生）,上海·浦东新区·张江,6-11K,经验不限本科,上海敏智,计算机软件未融资20-99人,餐补，带薪年假，节日福利，零食下午茶，全勤奖，员工旅游，加班补助，五险一金，年终奖,https://www.zhipin.com/job_detail/971b0802bafe67ee1n183t-9E1ZS.html
Python开发(SRE+DEVOPS方向),上海·杨浦区·五角场,20-40K·14薪,经验不限本科,脉策科技,互联网B轮100-499人,年终奖，补充医疗保险，带薪年假，节日福利，人才引进落户，定期体检，员工旅游，五险一金,https://www.zhipin.com/job_detail/6f882e151d366a791nx90920FFdR.html
python开发工程师,上海·闵行区·吴泾,11-18K,1-3年本科,匠昕科技,计算机软件未融资100-499人,节日福利，带薪年假，五险一金，交通补助,https://www.zhipin.com/job_detail/d0d73bdf5078324a1nF_2tW4E1BX.html
Python开发工程师,上海·浦东新区·张江,20-25K·15薪,3-5年本科,铭图天成,信息安全不需要融资100-499人,带薪年假，年终奖，五险一金，节日福利，零食下午茶，定期体检，餐补，员工旅游,https://www.zhipin.com/job_detail/84c57aac46fc11141XVz3Ni_EVdZ.html
Python开发工程师,上海·普陀区·长征,15-18K·14薪,1-3年本科,梭翱信息技术有限公司,电子商务不需要融资100-499人,节日福利，股票期权，商业保险，餐补，周末双休，五险一金，季度拓展，生日会，员工旅游，奖金，零食下午茶，带薪年假,https://www.zhipin.com/job_detail/5a300a0b338dc3af1XV-2tq-EFRT.html
Python开发工程师,上海·浦东新区·金桥,20-40K,3-5年本科,华为技术有限公司,计算机软件不需要融资10000人以上,定期体检，免费班车，零食下午茶，五险一金，住房补贴，员工旅游，加班补助，带薪年假，交通补助，节日福利，年终奖，通讯补贴，股票期权，补充医疗保险，全勤奖，餐补，离职补偿,https://www.zhipin.com/job_detail/e79d8ff82998787e1XVy3tu7EFNT.html
Python开发工程师,上海·长宁区·北新泾,15-20K,经验不限本科,北京纬创,计算机软件不需要融资1000-9999人,节日福利，带薪年假，定期体检，员工旅游，零食下午茶，五险一金,https://www.zhipin.com/job_detail/761a60bfb305f9d61XV_0ti9FVZR.html
Python开发工程师,上海·杨浦区·五角场,25-35K,5-10年大专,乾德,计算机软件未融资100-499人,加班补助，年终奖，带薪年假，员工旅游，节日福利，五险一金,https://www.zhipin.com/job_detail/dbe35d54af40b2831XV_3tm4EltZ.html
Python开发工程师,上海·浦东新区·金桥,12-24K,经验不限本科,中软国际,计算机软件已上市10000人以上,加班补助，免费班车，节日福利，餐补，员工旅游，五险一金，零食下午茶，定期体检，带薪年假，年终奖,https://www.zhipin.com/job_detail/f57ce572892029c31XR-0ty_FlBQ.html
python测试开发(JNB62),上海·嘉定区·安亭,18-20K,3-5年大专,中科创达软件,计算机软件已上市1000-9999人,定期体检，股票期权，全勤奖，餐补，带薪年假，节日福利，员工旅游，加班补助，年终奖，住房补贴，五险一金，交通补助,https://www.zhipin.com/job_detail/fc81670a383cc1331n1_3dq_FltR.html
Python 开发工程师,上海·杨浦区·五角场,25-40K·14薪,3-5年本科,格物钛,互联网A轮20-99人,五险一金，零食下午茶，交通补助，定期体检，节日福利，年终奖，员工旅游，带薪年假，股票期权,https://www.zhipin.com/job_detail/bd87d6f11e4259191nJ82tm4EVdR.html
python 开发测试工程师,上海·浦东新区·金桥,15-30K,经验不限本科,华为终端有限公司,通信/网络设备不需要融资10000人以上,免费班车，五险一金，年终奖，通讯补贴，员工旅游，零食下午茶，加班补助，节日福利，补充医疗保险，带薪年假，股票期权，定期体检，交通补助，住房补贴,https://www.zhipin.com/job_detail/2ffaf50eef6e0db51nJ62Ni_FFVW.html
Python实施工程师/RPA实施工程师,上海·静安区·大宁,16-22K·16薪,3-5年本科,壹沓科技,企业服务A轮100-499人,员工旅游，零食下午茶，节日福利，带薪年假，股票期权，年终奖，交通补助，定期体检，餐补，五险一金,https://www.zhipin.com/job_detail/522f4a162d1be9581XR_2965EFNV.html
python电商网站爬虫程序员,上海·浦东新区·新场,50-80K·16薪,经验不限学历不限,上海念露,文化/体育/娱乐0-20人,员工旅游，零食下午茶，包吃，股票期权,https://www.zhipin.com/job_detail/20d203c256e97e7c1nJ73Ny6F1VZ.html
CRM后端开发工程师—Python,上海·长宁区·新华路,20-40K·15薪,3-5年本科,叽里呱啦,互联网C轮100-499人,年终奖，餐补，通讯补贴，包吃，节日福利，定期体检，零食下午茶，五险一金，员工旅游，补充医疗保险，带薪年假,https://www.zhipin.com/job_detail/1debf5ba1e9336221XZ62dq5ElZV.html
Python开发工程师（云原生方向）,上海·浦东新区·塘桥,12-20K·14薪,经验不限本科,华讯网络,计算机软件未融资1000-9999人,带薪年假，加班补助，定期体检，通讯补贴，年终奖，交通补助，培养体系，员工旅游，五险一金，股票期权，补充医疗保险，节日福利,https://www.zhipin.com/job_detail/f68215816a04626b1nN73t27GVJV.html
Python开发工程师,上海·浦东新区·张江,12-22K,经验不限学历不限,数行科技,数据服务A轮20-99人,年终奖，员工旅游，带薪年假，五险一金，股票期权，补充医疗保险，通讯补贴，零食下午茶,https://www.zhipin.com/job_detail/3b6561e7465d54b11XR_2dy0E1pQ.html
中高级Python后端开发工程师,上海,16-30K·14薪,3-5年本科,旭荣科技,互联网未融资20-99人,零食下午茶，五险一金，国家法定假期，带薪年假，定期团建，节日福利，健身俱乐部，补充医疗保险，年终奖，结婚礼金，慰问礼金，定期户外拓展，1年2次调薪，餐补，带薪病假，定期海外旅游，生育礼金,https://www.zhipin.com/job_detail/b116590a680c25dd1nZ43dm8EFtU.html
Python开发工程师,上海·闵行区·虹桥,15-25K·13薪,3-5年大专,驿氪EZR,移动互联网B轮100-499人,员工旅游，零食下午茶，带薪年假，年终奖，五险一金，加班补助,https://www.zhipin.com/job_detail/4e79c02186071bcf1nN-0ty6GVdU.html
初级Python开发工程师,上海·杨浦区·新江湾城,15-30K,1-3年本科,复鹄科技,电子/半导体/集成电路天使轮20-99人,健身卡，定期体检，节日福利，五险一金，股票期权，餐补，年终奖，员工旅游，零食下午茶，补充医疗保险，带薪年假,https://www.zhipin.com/job_detail/c8a2735e5b885c8f1n1-0t68ElNZ.html
平台搭建/优化-量化开发工程师（python）,上海·虹口区·四川北路,50-80K,3-5年本科,启林投资,基金未融资100-499人,带薪年假，团建旅游，零食下午茶，定期体检，五险一金，年终奖，扁平管理，节日福利,https://www.zhipin.com/job_detail/47b7b2bb8737a4c81nJ_09y0EFRY.html
Python高级后端【兼职】,上海·闵行区·浦江,12-20K,5-10年本科,驭兆科技,互联网0-20人,,https://www.zhipin.com/job_detail/fb34244c8bfe3dd21nBz3dq5ElBZ.html
python开发工程师,上海·浦东新区·张江,25-40K·13薪,3-5年本科,兑辰科技,数据服务A轮20-99人,定期体检，零食下午茶，节日福利，股票期权，五险一金,https://www.zhipin.com/job_detail/879b80c395bea9081XR709u6F1BU.html
Python,上海·杨浦区·五角场,20-40K,经验不限本科,华云数据,数据服务D轮及以上500-999人,五险一金，免息购房，餐补，年终奖，股票期权，带薪年假，节日福利，定期体检,https://www.zhipin.com/job_detail/9c9b15cfac0bbea61n1y3t65E1BS.html
Python开发工程师,上海·徐汇区·岳阳,7-10K,1-3年本科,黑洞盒信息科技有...,计算机软件20-99人,,https://www.zhipin.com/job_detail/513de1a4b2ecb3091XRz39i4EVJW.html
Python工程师,上海·徐汇区·漕河泾,15-30K,1-3年本科,智云安科技,其他服务业未融资20-99人,包吃，补充医疗保险，年终奖，五险一金,https://www.zhipin.com/job_detail/b411044e4d4c6a811XZ63t-0E1NZ.html
Python开发工程师,上海,20-40K,3-5年本科,思勰投资,基金不需要融资20-99人,带薪年假，零食下午茶，定期体检，住房补贴，五险一金，餐补，年终奖，包吃，节日福利，员工旅游,https://www.zhipin.com/job_detail/b0b2f5bdf6ad3da91nBz39u5E1pW.html
python,上海·普陀区·长征,12-20K·13薪,3-5年本科,竟安科技,计算机软件天使轮20-99人,年终奖，交通补助，五险一金，调薪，餐补,https://www.zhipin.com/job_detail/8176b01c9b06adfb1nJ93du0F1dR.html
Python,上海·静安区·汶水路,10-12K,1年以内本科,好懂好记,O2O不需要融资100-499人,五险一金，零食下午茶，节日福利，年终奖,https://www.zhipin.com/job_detail/11907ab6b4a8f6b21XR-3t60F1BS.html
python开发,上海·浦东新区·金桥,18-30K,1-3年本科,上海华为技术有限公司,通信/网络设备不需要融资10000人以上,股票期权，定期体检，零食下午茶，员工旅游，年终奖，五险一金，带薪年假，加班补助，节日福利,https://www.zhipin.com/job_detail/6b9510c3c4ac4d1a1n1_39S1F1pS.html
Python工程师,上海·浦东新区·陆家嘴,15-25K,1年以内本科,俊丹私募基金,基金0-20人,,https://www.zhipin.com/job_detail/07289c73b187226f1XR709m0EVpX.html
python开发,上海·徐汇区·漕河泾,10-15K,1-3年本科,创米,消费电子B轮100-499人,加班补助，补充医疗保险，交通补助，餐补，节日福利，生日假，人才落户，员工旅游，股票期权，五险一金，定期体检，带薪年假，年终奖,https://www.zhipin.com/job_detail/2f1adf2109b29c561nN42ty9EVNZ.html
python量化开发工程师,上海·浦东新区·三林,12-24K,经验不限本科,红链科技,基金0-20人,,https://www.zhipin.com/job_detail/7349af487440c8d81nJ63du4ElpR.html
Python高级开发,上海·杨浦区·东外滩,30-50K·16薪,3-5年本科,得物App,电子商务B轮1000-9999人,股票期权，五险一金，年终奖，加班补助，餐补，带薪年假，定期体检，员工旅游，节日福利，交通补助，住房补贴，零食下午茶,https://www.zhipin.com/job_detail/1f4c3db87f44cf1c1nF42N2-EVJR.html
python工程师,上海·浦东新区·张江,20-35K·13薪,1-3年本科,逾谦科技,移动互联网不需要融资0-20人,股票期权，五险一金，年终奖，带薪年假，员工旅游,https://www.zhipin.com/job_detail/cfc66eb1c2dc912c1nFy3di0FFpU.html
python编程助教,上海·杨浦区·五角场,8-10K,1-3年本科,佑棵智能科技有限公司,院校20-99人,,https://www.zhipin.com/job_detail/94a61cfd89c1428f1nJ529y9FFtZ.html
Python开发工程师,上海·杨浦区·五角场,12-20K·13薪,3-5年本科,易钧信息,数据服务未融资20-99人,餐补，带薪年假，五险一金,https://www.zhipin.com/job_detail/d7545c9456c7dcf81XVz2Nq6F1pU.html
python开发工程师,上海·嘉定区·江桥,12-20K,1-3年大专,奥软信息,计算机软件20-99人,,https://www.zhipin.com/job_detail/176a9c508cc2d2e01n1-3tS6EFBY.html
